<?xml version="1.0" encoding="UTF-8"?>
<!DOCTYPE biblioteca SYSTEM "libro.dtd">
<biblioteca>
    <libro>
        <titulo>El Quijote</titulo>
        <autor>Miguel de Cervantes</autor>
        <editorial>Editorial A</editorial>
        <anio>1605</anio>
        <isbn>978-3-16-148410-0</isbn>
        <genero>Novela</genero>
        <idioma>Español</idioma>
        <descripcion>Una de las obras más importantes de la literatura española, que narra las aventuras de Don Quijote y su fiel escudero Sancho Panza.</descripcion>
    </libro>
    <libro>
        <titulo>Cien Años de Soledad</titulo>
        <autor>Gabriel García Márquez</autor>
        <editorial>Editorial B</editorial>
        <anio>1967</anio>
        <isbn>978-0-14-118499-9</isbn>
        <genero>Realismo mágico</genero>
        <idioma>Español</idioma>
        <descripcion>Una saga familiar que abarca varias generaciones en el pueblo ficticio de Macondo, explorando temas de soledad y destino.</descripcion>
    </libro>
    <libro>
        <titulo>La Sombra del Viento</titulo>
        <autor>Carlos Ruiz Zafón</autor>
        <editorial>Editorial C</editorial>
        <anio>2001</anio>
        <isbn>978-0-06-112970-9</isbn>
        <genero>Misterio</genero>
        <idioma>Español</idioma>
        <descripcion>Un joven descubre un libro misterioso que lo lleva a desentrañar los secretos de su autor y su propia vida.</descripcion>
    </libro>
    <libro>
        <titulo>1984</titulo>
        <autor>George Orwell</autor>
        <editorial>Editorial D</editorial>
        <anio>1949</anio>
        <isbn>978-0-452-28423-4</isbn>
        <genero>Distopía</genero>
        <idioma>Inglés</idioma>
        <descripcion>Una novela que describe una sociedad totalitaria y la vigilancia constante del Gran Hermano.</descripcion>
    </libro>
    <libro>
        <titulo>Orgullo y Prejuicio</titulo>
        <autor>Jane Austen</autor>
        <editorial>Editorial E</editorial>
        <anio>1813</anio>
        <isbn>978-0-19-953556-9</isbn>
        <genero>Romance</genero>
        <idioma>Inglés</idioma>
        <descripcion>Una historia de amor y malentendidos en la Inglaterra del siglo XIX.</descripcion>
    </libro>
    <libro>
        <titulo>El Gran Gatsby</titulo>
        <autor>F. Scott Fitzgerald</autor>
        <editorial>Editorial F</editorial>
        <anio>1925</anio>
        <isbn>978-0-7432-7356-5</isbn>
        <genero>Tragedia</genero>
        <idioma>Inglés</idioma>
        <descripcion>Una crítica a la sociedad estadounidense de los años 20 a través de la vida del misterioso Jay Gatsby.</descripcion>
    </libro>
    <libro>
        <titulo>Crimen y Castigo</titulo>
        <autor>Fiódor Dostoyevski</autor>
        <editorial>Editorial G</editorial>
        <anio>1866</anio>
        <isbn>978-0-14-044913-6</isbn>
        <genero>Filosófico</genero>
        <idioma>Ruso</idioma>
        <descripcion>La historia de un joven estudiante que comete un asesinato y enfrenta las consecuencias morales y psicológicas de su acto.</descripcion>
    </libro>
    <libro>
        <titulo>La Odisea</titulo>
        <autor>Homero</autor>
        <editorial>Editorial H</editorial>
        <anio>-800</anio>
        <isbn>978-0-14-026886-7</isbn>
        <genero>Épico</genero>
        <idioma>Griego</idioma>
        <descripcion>El viaje de regreso a casa del héroe griego Odiseo después de la guerra de Troya.</descripcion>
    </libro>
    <libro>
        <titulo>Don Juan Tenorio</titulo>
        <autor>José Zorrilla</autor>
        <editorial>Editorial I</editorial>
        <anio>1844</anio>
        <isbn>978-84-376-0494-7</isbn>
        <genero>Drama</genero>
        <idioma>Español</idioma>
        <descripcion>Una obra de teatro que narra las aventuras y desventuras del seductor Don Juan.</descripcion>
    </libro>
    <libro>
        <titulo>El Principito</titulo>
        <autor>Antoine de Saint-Exupéry</autor>
        <editorial>Editorial J</editorial>
        <anio>1943</anio>
        <isbn>978-0-15-601219-5</isbn>
        <genero>Fábula</genero>
        <idioma>Francés</idioma>
        <descripcion>Un cuento filosófico sobre un joven príncipe que viaja por el universo y aprende sobre la vida y el amor.</descripcion>
    </libro>
</biblioteca>
